CVE ID	Description	CVSS Vector
CVE-2024-10418	A vulnerability was found in code-projects Blood Bank Management System 1.0. It has been declared as critical. Affected by this vulnerability is an unknown functionality of the file /file/infoAdd.php. The manipulation of the argument bg leads to sql injection. The attack can be launched remotely. The exploit has been disclosed to the public and may be used.	CVSS:3.1/AV:N/AC:L/PR:N/UI:N/S:U/C:H/I:H/A:H
CVE-2024-10417	A vulnerability was found in code-projects Blood Bank Management System 1.0. It has been classified as critical. Affected is an unknown function of the file /file/delete.php. The manipulation of the argument bid leads to sql injection. It is possible to launch the attack remotely. The exploit has been disclosed to the public and may be used.	CVSS:3.1/AV:N/AC:L/PR:L/UI:N/S:U/C:H/I:H/A:H
CVE-2024-10416	A vulnerability was found in code-projects Blood Bank Management System 1.0 and classified as critical. This issue affects some unknown processing of the file /file/cancel.php. The manipulation of the argument reqid leads to sql injection. The attack may be initiated remotely. The exploit has been disclosed to the public and may be used.	CVSS:3.1/AV:N/AC:L/PR:L/UI:N/S:U/C:H/I:H/A:H
CVE-2024-10415	A vulnerability has been found in code-projects Blood Bank Management System 1.0 and classified as critical. This vulnerability affects unknown code of the file /file/accept.php. The manipulation of the argument reqid leads to sql injection. The attack can be initiated remotely. The exploit has been disclosed to the public and may be used.	CVSS:3.1/AV:N/AC:L/PR:L/UI:N/S:U/C:H/I:H/A:H
CVE-2024-10414	"A vulnerability, which was classified as problematic, was found in PHPGurukul Vehicle Record System 1.0. This affects an unknown part of the file /admin/edit-brand.php. The manipulation of the argument Brand Name leads to cross site scripting. It is possible to initiate the attack remotely. The exploit has been disclosed to the public and may be used. The initial researcher advisory mentions the parameter ""phone_number"" to be affected. But this might be a mistake because the textbox field label is ""Brand Name""."	CVSS:3.1/AV:N/AC:L/PR:H/UI:R/S:C/C:L/I:L/A:N
CVE-2024-10413	A vulnerability, which was classified as critical, has been found in SourceCodester Online Hotel Reservation System 1.0. Affected by this issue is the function upload of the file /guest/update.php. The manipulation of the argument image leads to unrestricted upload. The attack may be launched remotely. The exploit has been disclosed to the public and may be used.	CVSS:3.1/AV:N/AC:L/PR:N/UI:N/S:U/C:H/I:H/A:H
CVE-2024-10412	A vulnerability was found in Poco-z Guns-Medical 1.0. It has been declared as problematic. Affected by this vulnerability is the function upload of the file /mgr/upload of the component File Upload. The manipulation of the argument picture leads to cross site scripting. The attack can be launched remotely.	CVSS:3.1/AV:N/AC:L/PR:L/UI:R/S:C/C:L/I:L/A:N
CVE-2024-10411	A vulnerability was found in SourceCodester Online Hotel Reservation System 1.0. It has been classified as critical. Affected is the function doCancelRoom/doCancel/doConfirm/doCancel/doCheckin/doCheckout of the file /marimar/admin/mod_room/controller.php. The manipulation of the argument id leads to sql injection. It is possible to launch the attack remotely. The exploit has been disclosed to the public and may be used.	CVSS:3.1/AV:N/AC:L/PR:H/UI:N/S:U/C:H/I:H/A:H
CVE-2024-10410	A vulnerability classified as critical was found in SourceCodester Online Hotel Reservation System 1.0. Affected by this vulnerability is the function upload of the file /admin/mod_room/controller.php?action=add. The manipulation of the argument image leads to unrestricted upload. The attack can be launched remotely. The exploit has been disclosed to the public and may be used.	CVSS:3.1/AV:N/AC:L/PR:H/UI:N/S:U/C:H/I:H/A:H
CVE-2024-10409	A vulnerability was found in code-projects Blood Bank Management 1.0 and classified as critical. This issue affects some unknown processing of the file /file/accept.php. The manipulation of the argument reqid leads to sql injection. The attack may be initiated remotely. The exploit has been disclosed to the public and may be used.	CVSS:3.1/AV:N/AC:L/PR:L/UI:N/S:U/C:H/I:H/A:H
CVE-2024-10408	A vulnerability has been found in code-projects Blood Bank Management up to 1.0 and classified as critical. This vulnerability affects unknown code of the file /abs.php. The manipulation of the argument search leads to sql injection. The attack can be initiated remotely. The exploit has been disclosed to the public and may be used.	CVSS:3.1/AV:N/AC:L/PR:L/UI:N/S:U/C:H/I:H/A:H
CVE-2024-10407	A vulnerability, which was classified as critical, was found in SourceCodester Petrol Pump Management Software 1.0. This affects an unknown part of the file /admin/edit_customer.php. The manipulation of the argument id leads to sql injection. It is possible to initiate the attack remotely. The exploit has been disclosed to the public and may be used.	CVSS:3.1/AV:N/AC:L/PR:H/UI:N/S:U/C:H/I:H/A:H
CVE-2024-10406	A vulnerability, which was classified as critical, has been found in SourceCodester Petrol Pump Management Software 1.0. Affected by this issue is some unknown functionality of the file /admin/edit_fuel.php. The manipulation of the argument id leads to sql injection. The attack may be launched remotely. The exploit has been disclosed to the public and may be used.	CVSS:3.1/AV:N/AC:L/PR:H/UI:N/S:U/C:H/I:H/A:H
CVE-2020-26311	Useragent is a user agent parser for Node.js. All versions as of time of publication contain one or more regular expressions that are vulnerable to Regular Expression Denial of Service (ReDoS). As of time of publication, no patches are available.	CVSS:3.1/AV:N/AC:L/PR:N/UI:N/S:U/C:N/I:N/A:H
CVE-2024-9501	The Wp Social Login and Register Social Counter plugin for WordPress is vulnerable to authentication bypass in all versions up to, and including, 3.0.7. This is due to insufficient verification on the user being returned by the social login token. This makes it possible for unauthenticated attackers to log in as any existing user on the site, such as an administrator, if they have access to the email and the user does not have an already-existing account for the service returning the token.	CVSS:3.1/AV:N/AC:L/PR:N/UI:N/S:U/C:H/I:H/A:H
CVE-2024-10402	The Forminator Forms – Contact Form, Payment Form & Custom Form Builder plugin for WordPress is vulnerable to unauthorized access due to a missing capability check on a function in all versions up to, and including, 1.35.1. This makes it possible for authenticated attackers, with Contributor-level access and above, and permissions granted by an Administrator, to create new or edit existing forms, including updating the default registration role to Administrator on User Registration forms.	CVSS:3.1/AV:N/AC:H/PR:L/UI:N/S:U/C:H/I:H/A:H
CVE-2024-10117	The WP Crowdfunding plugin for WordPress is vulnerable to Stored Cross-Site Scripting via the plugin's wpcf_donate shortcode in all versions up to, and including, 2.1.11 due to insufficient input sanitization and output escaping on user supplied attributes. This makes it possible for authenticated attackers, with contributor-level access and above, to inject arbitrary web scripts in pages that will execute whenever a user accesses an injected page.	CVSS:3.1/AV:N/AC:L/PR:L/UI:N/S:C/C:L/I:L/A:N
CVE-2024-9772	The The Uix Shortcodes – Compatible with Gutenberg plugin for WordPress is vulnerable to arbitrary shortcode execution in all versions up to, and including, 1.9.9. This is due to the software allowing users to execute an action that does not properly validate a value before running do_shortcode. This makes it possible for unauthenticated attackers to execute arbitrary shortcodes.	CVSS:3.1/AV:N/AC:L/PR:N/UI:N/S:U/C:L/I:L/A:L
CVE-2024-9116	The Monkee-Boy Essentials plugin for WordPress is vulnerable to Stored Cross-Site Scripting via SVG File uploads in all versions up to, and including, 1.1 due to insufficient input sanitization and output escaping. This makes it possible for authenticated attackers, with Author-level access and above, to inject arbitrary web scripts in pages that will execute whenever a user accesses the SVG file.	CVSS:3.1/AV:N/AC:L/PR:L/UI:N/S:C/C:L/I:L/A:N
CVE-2024-10357	The Clever Addons for Elementor plugin for WordPress is vulnerable to Sensitive Information Exposure in all versions up to, and including, 2.2.1 via the getTemplateContent function in src/widgets/class-clever-widget-base.php. This makes it possible for authenticated attackers, with Contributor-level access and above, to extract sensitive private, pending, and draft template data.	CVSS:3.1/AV:N/AC:L/PR:L/UI:N/S:U/C:L/I:N/A:N
CVE-2024-9967	The WP show more plugin for WordPress is vulnerable to Stored Cross-Site Scripting via the plugin's show_more shortcode in all versions up to, and including, 1.0.7 due to insufficient input sanitization and output escaping on user supplied attributes. This makes it possible for authenticated attackers, with contributor-level access and above, to inject arbitrary web scripts in pages that will execute whenever a user accesses an injected page.	CVSS:3.1/AV:N/AC:L/PR:L/UI:N/S:C/C:L/I:L/A:N
CVE-2024-9853	The ID-SK Toolkit plugin for WordPress is vulnerable to Stored Cross-Site Scripting via SVG File uploads in all versions up to, and including, 1.7.2 due to insufficient input sanitization and output escaping. This makes it possible for authenticated attackers, with Author-level access and above, to inject arbitrary web scripts in pages that will execute whenever a user accesses the SVG file.	CVSS:3.1/AV:N/AC:L/PR:L/UI:N/S:C/C:L/I:L/A:N
CVE-2024-9642	The Editor Custom Color Palette plugin for WordPress is vulnerable to Stored Cross-Site Scripting via SVG File uploads in all versions up to, and including, 3.3.7 due to insufficient input sanitization and output escaping. This makes it possible for authenticated attackers, with Author-level access and above, to inject arbitrary web scripts in pages that will execute whenever a user accesses the SVG file.	CVSS:3.1/AV:N/AC:L/PR:L/UI:N/S:C/C:L/I:L/A:N
CVE-2024-9637	The School Management System – WPSchoolPress plugin for WordPress is vulnerable to privilege escalation via account takeover in all versions up to, and including, 2.2.10. This is due to the plugin not properly validating a user's identity prior to updating their details like email. This makes it possible for authenticated attackers, with teacher-level access and above, to change arbitrary user's email addresses, including administrators, and leverage that to reset the user's password and gain access to their account.	CVSS:3.1/AV:N/AC:L/PR:L/UI:N/S:U/C:H/I:H/A:H
CVE-2024-8392	The WordPress Post Grid Layouts with Pagination – Sogrid plugin for WordPress is vulnerable to Local File Inclusion in all versions up to, and including, 1.5.2 via the 'tab' parameter. This makes it possible for authenticated attackers, with Administrator-level access and above, to include and execute arbitrary files on the server, allowing the execution of any PHP code in those files. This can be used to bypass access controls, obtain sensitive data, or achieve code execution in cases where images and other “safe” file types can be uploaded and included. This can also be exploited via CSRF techniques.	CVSS:3.1/AV:N/AC:L/PR:H/UI:N/S:U/C:H/I:H/A:H
CVE-2024-10092	The Download Monitor plugin for WordPress is vulnerable to unauthorized modification of data due to a missing capability check on the ajax_handle_api_key_actions function in all versions up to, and including, 5.0.12. This makes it possible for authenticated attackers, with Subscriber-level access and above, to revoke existing API keys and generate new ones.	CVSS:3.1/AV:N/AC:L/PR:L/UI:N/S:U/C:N/I:L/A:N
CVE-2024-9456	The WP Awesome Login plugin for WordPress is vulnerable to Stored Cross-Site Scripting via SVG File uploads in all versions up to, and including, 0.4.0 due to insufficient input sanitization and output escaping. This makes it possible for authenticated attackers, with Author-level access and above, to inject arbitrary web scripts in pages that will execute whenever a user accesses the SVG file.	CVSS:3.1/AV:N/AC:L/PR:L/UI:N/S:C/C:L/I:L/A:N
CVE-2024-8870	The Forms for Mailchimp by Optin Cat – Grow Your MailChimp List plugin for WordPress is vulnerable to Reflected Cross-Site Scripting due to the use of add_query_arg without appropriate escaping on the URL in all versions up to, and including, 2.5.6. This makes it possible for unauthenticated attackers to inject arbitrary web scripts in pages that execute if they can successfully trick a user into performing an action such as clicking on a link.	CVSS:3.1/AV:N/AC:L/PR:N/UI:R/S:C/C:L/I:L/A:N
CVE-2024-9932	The Wux Blog Editor plugin for WordPress is vulnerable to arbitrary file uploads due to insufficient file type validation in the 'wuxbt_insertImageNew' function in versions up to, and including, 3.0.0. This makes it possible for unauthenticated attackers to upload arbitrary files on the affected site's server which may make remote code execution possible.	CVSS:3.1/AV:N/AC:L/PR:N/UI:N/S:U/C:H/I:H/A:H
CVE-2024-9931	The Wux Blog Editor plugin for WordPress is vulnerable to authentication bypass in versions up to, and including, 3.0.0. This is due to missing validation on the token being supplied during the autologin through the plugin. This makes it possible for unauthenticated attackers to log in to the first administrator user.	CVSS:3.1/AV:N/AC:L/PR:N/UI:N/S:U/C:H/I:H/A:H
CVE-2024-9930	The Extensions by HocWP Team plugin for WordPress is vulnerable to authentication bypass in versions up to, and including, 0.2.3.2. This is due to missing validation on the user being supplied in the 'verify_email' action. This makes it possible for unauthenticated attackers to log in as any existing user on the site, such as an administrator. The vulnerability is in the Account extension.	CVSS:3.1/AV:N/AC:L/PR:N/UI:N/S:U/C:H/I:H/A:H
CVE-2024-9890	The User Toolkit plugin for WordPress is vulnerable to authentication bypass in versions up to, and including, 1.2.3. This is due to an improper capability check in the 'switchUser' function. This makes it possible for authenticated attackers, with subscriber-level permissions and above, to log in as any existing user on the site, such as an administrator.	CVSS:3.1/AV:N/AC:L/PR:L/UI:N/S:U/C:H/I:H/A:H
CVE-2024-9613	The FormFacade – WordPress plugin for Google Forms plugin for WordPress is vulnerable to Reflected Cross-Site Scripting via the 'userId' and 'publishId' parameters in all versions up to, and including, 1.3.6 due to insufficient input sanitization and output escaping. This makes it possible for unauthenticated attackers to inject arbitrary web scripts in pages that execute if they can successfully trick a user into performing an action such as clicking on a link.	CVSS:3.1/AV:N/AC:L/PR:N/UI:R/S:C/C:L/I:L/A:N
CVE-2024-9475	The Poll Maker – Versus Polls, Anonymous Polls, Image Polls plugin for WordPress is vulnerable to generic SQL Injection via the order_by parameter in all versions up to, and including, 5.4.6  due to insufficient escaping on the user-supplied parameter and lack of sufficient preparation on the existing SQL query.  This makes it possible for authenticated attackers, with administrator-level permissions and above, to append additional SQL queries into already existing queries that can be used to extract sensitive information from the database.	CVSS:3.1/AV:N/AC:L/PR:H/UI:N/S:U/C:H/I:N/A:N
CVE-2024-9462	The Poll Maker – Versus Polls, Anonymous Polls, Image Polls plugin for WordPress is vulnerable to Stored Cross-Site Scripting via poll settings in all versions up to, and including, 5.4.6 due to insufficient input sanitization and output escaping. This makes it possible for authenticated attackers, with administrator-level permissions and above, to inject arbitrary web scripts in pages that will execute whenever a user accesses an injected page. This only affects multi-site installations and installations where unfiltered_html has been disabled.	CVSS:3.1/AV:N/AC:L/PR:H/UI:N/S:C/C:L/I:L/A:N
CVE-2024-9454	The PriPre plugin for WordPress is vulnerable to Stored Cross-Site Scripting via SVG File uploads in all versions up to, and including, 0.4.11 due to insufficient input sanitization and output escaping. This makes it possible for authenticated attackers, with Author-level access and above, to inject arbitrary web scripts in pages that will execute whenever a user accesses the SVG file.	CVSS:3.1/AV:N/AC:L/PR:L/UI:N/S:C/C:L/I:L/A:N
CVE-2024-10091	The ElementsKit Elementor addons plugin for WordPress is vulnerable to Stored Cross-Site Scripting via the Image Comparison Widget in all versions up to, and including, 3.2.9 due to insufficient input sanitization and output escaping on user supplied attributes. This makes it possible for authenticated attackers, with contributor-level access and above, to inject arbitrary web scripts in pages that will execute whenever a user accesses an injected page.	CVSS:3.1/AV:N/AC:L/PR:L/UI:N/S:C/C:L/I:L/A:N
CVE-2024-48230	funadmin 5.0.2 is vulnerable to SQL Injection via the parentField parameter in the index method of \backend\controller\auth\Auth.php.	CVSS:3.1/AV:N/AC:L/PR:H/UI:N/S:U/C:H/I:H/A:H
CVE-2024-48229	funadmin 5.0.2 has a SQL injection vulnerability in the Curd one click command mode plugin.	CVSS:3.1/AV:N/AC:L/PR:H/UI:N/S:U/C:H/I:H/A:H
CVE-2024-48227	Funadmin 5.0.2 has a logical flaw in the Curd one click command deletion function, which can result in a Denial of Service (DOS).	CVSS:3.1/AV:N/AC:L/PR:H/UI:N/S:U/C:N/I:N/A:H
CVE-2024-48226	Funadmin 5.0.2 is vulnerable to SQL Injection in curd/table/savefield.	CVSS:3.1/AV:N/AC:L/PR:H/UI:N/S:U/C:H/I:H/A:H
CVE-2024-48225	Funadmin v5.0.2 has an arbitrary file deletion vulnerability in /curd/index/delfile.	CVSS:3.1/AV:N/AC:L/PR:H/UI:N/S:U/C:N/I:H/A:H
CVE-2024-48224	Funadmin v5.0.2 has an arbitrary file read vulnerability in /curd/index/editfile.	CVSS:3.1/AV:N/AC:L/PR:H/UI:N/S:U/C:H/I:N/A:N
CVE-2024-48223	Funadmin v5.0.2 has a SQL injection vulnerability in /curd/table/fieldlist.	CVSS:3.1/AV:N/AC:L/PR:H/UI:N/S:U/C:H/I:H/A:H
CVE-2024-48222	Funadmin v5.0.2 has a SQL injection vulnerability in /curd/table/edit.	CVSS:3.1/AV:N/AC:L/PR:H/UI:N/S:U/C:H/I:H/A:H
CVE-2024-48218	Funadmin v5.0.2 has a SQL injection vulnerability in /curd/table/list.	CVSS:3.1/AV:N/AC:L/PR:H/UI:N/S:U/C:H/I:H/A:H
CVE-2024-9585	The Image Map Pro plugin for WordPress is vulnerable to Stored Cross-Site Scripting via the 'save_project' function with an arbitrary shortcode in versions up to, and including, 6.0.20 due to insufficient input sanitization and output escaping on user supplied attributes. This makes it possible for authenticated attackers with contributor-level and above permissions to inject arbitrary web scripts in pages that will execute whenever a user accesses an injected page.	CVSS:3.1/AV:N/AC:L/PR:L/UI:N/S:C/C:L/I:L/A:N
CVE-2024-9584	The Image Map Pro plugin for WordPress is vulnerable to unauthorized modification of data and loss of data due to a missing capability check on the AJAX functions in versions up to, and including, 6.0.20. This makes it possible for authenticated attackers with contributor-level privileges or above, to add, update or delete map projects.	CVSS:3.1/AV:N/AC:L/PR:L/UI:N/S:U/C:N/I:L/A:L
CVE-2022-30361	OvalEdge 5.2.8.0 and earlier is affected by a Sensitive Data Exposure vulnerability via a GET request to /user/getUserType. No authentication is required. The information disclosed is associated with the registered user ID, status, email address, role(s), user type, license type, and personal details such as first name, last name, gender, and user preferences.	CVSS:3.1/AV:N/AC:L/PR:N/UI:N/S:U/C:L/I:N/A:N
CVE-2022-30360	OvalEdge 5.2.8.0 and earlier is affected by multiple Stored XSS (AKA Persistent or Type II) vulnerabilities via a POST request to /profile/updateProfile via the slackid or phone parameters. Authentication is required.	CVSS:3.1/AV:N/AC:L/PR:L/UI:N/S:C/C:L/I:L/A:N
CVE-2022-30359	OvalEdge 5.2.8.0 and earlier is affected by a Sensitive Data Exposure vulnerability via a GET request to /user/getUserList. Authentication is required. The information disclosed is associated with the all registered users, including user ID, status, email address, role(s), user type, license type, and personal details such as first name, last name, gender, and user preferences.	CVSS:3.1/AV:N/AC:L/PR:L/UI:N/S:U/C:L/I:N/A:N
CVE-2022-30358	OvalEdge 5.2.8.0 and earlier is affected by an Account Takeover vulnerability via a POST request to /user/updatePassword via the userId and newPsw parameters. Authentication is required.	CVSS:3.1/AV:N/AC:L/PR:L/UI:N/S:U/C:H/I:H/A:H
CVE-2022-30357	OvalEdge 5.2.8.0 and earlier is affected by an Account Takeover vulnerability via a POST request to /profile/updateProfile via the userId and email parameters. Authentication is required.	CVSS:3.1/AV:N/AC:L/PR:L/UI:N/S:U/C:H/I:H/A:H
CVE-2022-30356	OvalEdge 5.2.8.0 and earlier is affected by a Privilege Escalation vulnerability via a POST request to /user/assignuserrole via the userid and role parameters . Authentication is required with OE_ADMIN role privilege.	CVSS:3.1/AV:N/AC:L/PR:H/UI:N/S:U/C:L/I:L/A:L
CVE-2024-10380	A vulnerability, which was classified as critical, has been found in SourceCodester Petrol Pump Management Software 1.0. Affected by this issue is some unknown functionality of the file /admin/ajax_product.php. The manipulation of the argument drop_services leads to sql injection. The attack may be launched remotely. The exploit has been disclosed to the public and may be used.	CVSS:3.1/AV:N/AC:L/PR:N/UI:N/S:U/C:H/I:N/A:N
CVE-2024-10379	A vulnerability classified as problematic was found in ESAFENET CDG 5. Affected by this vulnerability is the function actionViewDecyptFile of the file /com/esafenet/servlet/client/DecryptApplicationService.java. The manipulation of the argument decryptFileId with the input ../../../Windows/System32/drivers/etc/hosts leads to path traversal: '../filedir'. The attack can be launched remotely. The exploit has been disclosed to the public and may be used. The affected function has a typo and is missing an R. The vendor was contacted early about this disclosure but did not respond in any way.	CVSS:3.1/AV:N/AC:L/PR:N/UI:N/S:U/C:H/I:N/A:N
CVE-2024-10378	A vulnerability classified as critical has been found in ESAFENET CDG 5. Affected is the function actionViewCDGRenewFile of the file /com/esafenet/servlet/client/CDGRenewApplicationService.java. The manipulation of the argument CDGRenewFileId leads to sql injection. It is possible to launch the attack remotely. The exploit has been disclosed to the public and may be used. The vendor was contacted early about this disclosure but did not respond in any way.	CVSS:3.1/AV:N/AC:L/PR:N/UI:N/S:U/C:H/I:H/A:H
CVE-2024-10374	The WP-Members Membership Plugin plugin for WordPress is vulnerable to Stored Cross-Site Scripting via the plugin's wpmem_loginout shortcode in all versions up to, and including, 3.4.9.5 due to insufficient input sanitization and output escaping on user supplied attributes. This makes it possible for authenticated attackers, with contributor-level access and above, to inject arbitrary web scripts in pages that will execute whenever a user accesses an injected page.	CVSS:3.1/AV:N/AC:L/PR:L/UI:R/S:C/C:L/I:L/A:N
CVE-2024-47483	Dell Data Lakehouse, version(s) 1.0.0.0 and 1.1.0.0, contain(s) an Improper Neutralization of Special Elements used in an SQL Command ('SQL Injection') vulnerability. An unauthenticated attacker with local access could potentially exploit this vulnerability, leading to Information disclosure.	CVSS:3.1/AV:L/AC:L/PR:L/UI:N/S:U/C:H/I:N/A:N
CVE-2024-47481	Dell Data Lakehouse, version(s) 1.0.0.0, 1.1.0., contain(s) an Improper Access Control vulnerability. An unauthenticated attacker with adjacent network access could potentially exploit this vulnerability, leading to Denial of service.	CVSS:3.1/AV:A/AC:L/PR:N/UI:N/S:U/C:N/I:N/A:H
CVE-2024-47035	In vring_init of external/headers/include/virtio/virtio_ring.h, there is a possible out of bounds write due to a logic error in the code. This could lead to local escalation of privilege with no additional execution privileges needed. User interaction is not needed for exploitation.	CVSS:3.1/AV:L/AC:L/PR:L/UI:N/S:U/C:H/I:H/A:H
CVE-2024-47034	there is a possible out of bounds read due to a missing bounds check. This could lead to local information disclosure with no additional execution privileges needed. User interaction is not needed for exploitation.	CVSS:3.1/AV:L/AC:L/PR:L/UI:N/S:U/C:H/I:N/A:N
CVE-2024-47033	In lwis_allocator_free of lwis_allocator.c, there is a possible memory corruption due to a use after free. This could lead to local escalation of privilege with no additional execution privileges needed. User interaction is not needed for exploitation.	CVSS:3.1/AV:L/AC:L/PR:L/UI:N/S:U/C:H/I:H/A:H
CVE-2024-47029	In TrustySharedMemoryManager::GetSharedMemory of ondevice/trusty/trusty_shared_memory_manager.cc, there is a possible out of bounds read due to an incorrect bounds check. This could lead to local information disclosure with no additional execution privileges needed. User interaction is not needed for exploitation.	CVSS:3.1/AV:L/AC:L/PR:L/UI:N/S:U/C:H/I:N/A:N
CVE-2024-47028	In ffu_flash_pack of ffu.c, there is a possible out of bounds read due to an integer overflow. This could lead to local information disclosure with System execution privileges needed. User interaction is not needed for exploitation.	CVSS:3.1/AV:L/AC:L/PR:H/UI:N/S:U/C:H/I:N/A:N
