CVE ID	Description	CVSS Vector
CVE-2016-15042	The Frontend File Manager (versions < 4.0), N-Media Post Front-end Form (versions < 1.1) plugins for WordPress are vulnerable to arbitrary file uploads due to missing file type validation via the `nm_filemanager_upload_file` and `nm_postfront_upload_file` AJAX actions. This makes it possible for unauthenticated attackers to upload arbitrary files on the affected sites server which may make remote code execution possible.	CVSS:3.1/AV:N/AC:L/PR:N/UI:N/S:U/C:H/I:H/A:H
CVE-2022-4973	"WordPress Core, in versions up to 6.0.2, is vulnerable to Authenticated Stored Cross-Site Scripting that can be exploited by users with access to the WordPress post and page editor, typically consisting of Authors, Contributors, and Editors making it possible to inject arbitrary web scripts into posts and pages that execute if the the_meta(); function is called on that page."	CVSS:3.1/AV:N/AC:L/PR:L/UI:R/S:C/C:L/I:L/A:N
CVE-2022-4972	The Download Monitor plugin for WordPress is vulnerable to authorization bypass due to a missing capability check on several REST-API routes related to reporting in versions up to, and including, 4.7.51. This makes it possible for unauthenticated attackers to view user data and other sensitive information intended for administrators.	CVSS:3.1/AV:N/AC:L/PR:N/UI:N/S:U/C:H/I:N/A:N
CVE-2022-4971	The Sassy Social Share plugin for WordPress is vulnerable to Reflected Cross-Site Scripting via the 'urls' parameter called via the 'heateor_sss_sharing_count' AJAX action in versions up to, and including, 3.3.3 due to insufficient input sanitization and output escaping. This makes it possible for unauthenticated attackers to inject arbitrary web scripts in pages that execute if they can successfully trick a user into performing an action such as clicking on a link.	CVSS:3.1/AV:N/AC:L/PR:N/UI:R/S:C/C:L/I:L/A:N
CVE-2021-4451	The NinjaFirewall plugin for WordPress is vulnerable to Authenticated PHAR Deserialization in versions up to, and including, 4.3.3. This allows authenticated attackers to perform phar deserialization on the server.  This deserialization can allow other plugin or theme exploits if vulnerable software is present (WordPress, and NinjaFirewall).	CVSS:3.1/AV:N/AC:L/PR:H/UI:N/S:U/C:H/I:H/A:H
CVE-2021-4450	The Post Grid plugin for WordPress is vulnerable to blind SQL Injection via post metadata in versions up to, and including, 2.1.12 due to insufficient escaping on the user supplied parameter and lack of sufficient preparation on the existing SQL query.  This makes it possible for authenticated attackers with contributor-level permissions and above to append additional SQL queries into already existing queries that can be used to extract sensitive information from the database.	CVSS:3.1/AV:N/AC:L/PR:L/UI:N/S:U/C:H/I:H/A:H
CVE-2021-4449	The ZoomSounds plugin for WordPress is vulnerable to arbitrary file uploads due to missing file type validation in the 'savepng.php' file in versions up to, and including, 5.96. This makes it possible for unauthenticated attackers to upload arbitrary files on the affected site's server which may make remote code execution possible.	CVSS:3.1/AV:N/AC:L/PR:N/UI:N/S:U/C:H/I:H/A:H
CVE-2021-4448	The Kaswara Modern VC Addons plugin for WordPress is vulnerable to authorization bypass in versions up to, and including, 3.0.1 due to insufficient capability checking on various AJAX actions. This makes it possible for unauthenticated attackers to perform a wide variety of unauthorized actions such as importing data, uploading arbitrary files, deleting arbitrary files, and more.	CVSS:3.1/AV:N/AC:L/PR:N/UI:N/S:U/C:H/I:H/A:H
CVE-2019-25213	The Advanced Access Manager plugin for WordPress is vulnerable to Unauthenticated Arbitrary File Read in versions up to, and including, 5.9.8.1 due to insufficient validation on the aam-media parameter. This allows unauthenticated attackers to read any file on the server, including sensitive files such as wp-config.php	CVSS:3.1/AV:N/AC:L/PR:N/UI:N/S:U/C:H/I:N/A:N
CVE-2018-25105	The  File Manager plugin for WordPress is vulnerable to authorization bypass due to a missing capability check in the /inc/root.php file in versions up to, and including, 3.0. This makes it possible for unauthenticated attackers to download arbitrary files from the server and upload arbitrary files that can be used for remote code execution.	CVSS:3.1/AV:N/AC:L/PR:N/UI:N/S:U/C:H/I:H/A:H
CVE-2024-21251	Vulnerability in the Java VM component of Oracle Database Server.  Supported versions that are affected are 19.3-19.24, 21.3-21.15 and  23.4-23.5. Difficult to exploit vulnerability allows low privileged attacker having Create Session, Create Procedure privilege with network access via Oracle Net to compromise Java VM.  Successful attacks of this vulnerability can result in  unauthorized update, insert or delete access to some of Java VM accessible data. CVSS 3.1 Base Score 3.1 (Integrity impacts).  CVSS Vector: (CVSS:3.1/AV:N/AC:H/PR:L/UI:N/S:U/C:N/I:L/A:N).	CVSS:3.1/AV:N/AC:H/PR:L/UI:N/S:U/C:N/I:L/A:N
CVE-2024-21249	Vulnerability in the PeopleSoft Enterprise FIN Expenses product of Oracle PeopleSoft (component: Expenses).   The supported version that is affected is 9.2. Easily exploitable vulnerability allows low privileged attacker with network access via HTTP to compromise PeopleSoft Enterprise FIN Expenses.  Successful attacks of this vulnerability can result in  unauthorized read access to a subset of PeopleSoft Enterprise FIN Expenses accessible data. CVSS 3.1 Base Score 4.3 (Confidentiality impacts).  CVSS Vector: (CVSS:3.1/AV:N/AC:L/PR:L/UI:N/S:U/C:L/I:N/A:N).	CVSS:3.1/AV:N/AC:L/PR:L/UI:N/S:U/C:L/I:N/A:N
CVE-2024-21233	Vulnerability in the Oracle Database Core component of Oracle Database Server.  Supported versions that are affected are 19.3-19.24, 21.3-21.15 and  23.4-23.5. Easily exploitable vulnerability allows low privileged attacker having Create Session privilege with network access via Oracle Net to compromise Oracle Database Core.  Successful attacks of this vulnerability can result in  unauthorized update, insert or delete access to some of Oracle Database Core accessible data. CVSS 3.1 Base Score 4.3 (Integrity impacts).  CVSS Vector: (CVSS:3.1/AV:N/AC:L/PR:L/UI:N/S:U/C:N/I:L/A:N).	CVSS:3.1/AV:N/AC:L/PR:L/UI:N/S:U/C:N/I:L/A:N
CVE-2024-21211	"Vulnerability in the Oracle Java SE, Oracle GraalVM for JDK, Oracle GraalVM Enterprise Edition product of Oracle Java SE (component: Compiler).  Supported versions that are affected are Oracle Java SE: 23; Oracle GraalVM for JDK: 17.0.12, 21.0.4, 23; Oracle GraalVM Enterprise Edition: 20.3.15 and  21.3.11. Difficult to exploit vulnerability allows unauthenticated attacker with network access via multiple protocols to compromise Oracle Java SE, Oracle GraalVM for JDK, Oracle GraalVM Enterprise Edition.  Successful attacks of this vulnerability can result in  unauthorized update, insert or delete access to some of Oracle Java SE, Oracle GraalVM for JDK, Oracle GraalVM Enterprise Edition accessible data. Note: This vulnerability can be exploited by using APIs in the specified Component, e.g., through a web service which supplies data to the APIs. This vulnerability also applies to Java deployments, typically in clients running sandboxed Java Web Start applications or sandboxed Java applets, that load and run untrusted code (e.g., code that comes from the internet) and rely on the Java sandbox for security. CVSS 3.1 Base Score 3.7 (Integrity impacts).  CVSS Vector: (CVSS:3.1/AV:N/AC:H/PR:N/UI:N/S:U/C:N/I:L/A:N)."	CVSS:3.1/AV:N/AC:H/PR:N/UI:N/S:U/C:N/I:L/A:N
CVE-2024-21210	Vulnerability in Oracle Java SE (component: Hotspot).  Supported versions that are affected are Oracle Java SE: 8u421, 8u421-perf, 11.0.24, 17.0.12, 21.0.4 and  23. Difficult to exploit vulnerability allows unauthenticated attacker with network access via multiple protocols to compromise Oracle Java SE.  Successful attacks of this vulnerability can result in  unauthorized update, insert or delete access to some of Oracle Java SE accessible data. Note: This vulnerability can be exploited by using APIs in the specified Component, e.g., through a web service which supplies data to the APIs. This vulnerability also applies to Java deployments, typically in clients running sandboxed Java Web Start applications or sandboxed Java applets, that load and run untrusted code (e.g., code that comes from the internet) and rely on the Java sandbox for security. CVSS 3.1 Base Score 3.7 (Integrity impacts).  CVSS Vector: (CVSS:3.1/AV:N/AC:H/PR:N/UI:N/S:U/C:N/I:L/A:N).	CVSS:3.1/AV:N/AC:H/PR:N/UI:N/S:U/C:N/I:L/A:N
CVE-2024-21208	"Vulnerability in the Oracle Java SE, Oracle GraalVM for JDK, Oracle GraalVM Enterprise Edition product of Oracle Java SE (component: Networking).  Supported versions that are affected are Oracle Java SE: 8u421, 8u421-perf, 11.0.24, 17.0.12, 21.0.4, 23; Oracle GraalVM for JDK: 17.0.12, 21.0.4, 23; Oracle GraalVM Enterprise Edition: 20.3.15 and  21.3.11. Difficult to exploit vulnerability allows unauthenticated attacker with network access via multiple protocols to compromise Oracle Java SE, Oracle GraalVM for JDK, Oracle GraalVM Enterprise Edition.  Successful attacks of this vulnerability can result in unauthorized ability to cause a partial denial of service (partial DOS) of Oracle Java SE, Oracle GraalVM for JDK, Oracle GraalVM Enterprise Edition. Note: This vulnerability applies to Java deployments, typically in clients running sandboxed Java Web Start applications or sandboxed Java applets, that load and run untrusted code (e.g., code that comes from the internet) and rely on the Java sandbox for security. This vulnerability does not apply to Java deployments, typically in servers, that load and run only trusted code (e.g., code installed by an administrator). CVSS 3.1 Base Score 3.7 (Availability impacts).  CVSS Vector: (CVSS:3.1/AV:N/AC:H/PR:N/UI:N/S:U/C:N/I:N/A:L)."	CVSS:3.1/AV:N/AC:H/PR:N/UI:N/S:U/C:N/I:N/A:L
CVE-2024-21206	Vulnerability in the Oracle Enterprise Command Center Framework product of Oracle E-Business Suite (component: Diagnostics).  Supported versions that are affected are ECC:11-13. Easily exploitable vulnerability allows low privileged attacker with network access via HTTP to compromise Oracle Enterprise Command Center Framework.  Successful attacks of this vulnerability can result in  unauthorized read access to a subset of Oracle Enterprise Command Center Framework accessible data. CVSS 3.1 Base Score 4.3 (Confidentiality impacts).  CVSS Vector: (CVSS:3.1/AV:N/AC:L/PR:L/UI:N/S:U/C:L/I:N/A:N).	CVSS:3.1/AV:N/AC:L/PR:L/UI:N/S:U/C:L/I:N/A:N
CVE-2024-9676	A vulnerability was found in Podman, Buildah, and CRI-O. A symlink traversal vulnerability in the containers/storage library can cause Podman, Buildah, and CRI-O to hang and result in a denial of service via OOM kill when running a malicious image using an automatically assigned user namespace (`--userns=auto` in Podman and Buildah). The containers/storage library will read /etc/passwd inside the container, but does not properly validate if that file is a symlink, which can be used to cause the library to read an arbitrary file on the host.	CVSS:3.1/AV:N/AC:L/PR:L/UI:N/S:U/C:N/I:N/A:H
CVE-2024-48120	"X2CRM v8.5 is vulnerable to a stored Cross-Site Scripting (XSS) in the ""Opportunities"" module. An attacker can inject malicious JavaScript code into the ""Name"" field when creating a list."	CVSS:3.1/AV:N/AC:L/PR:L/UI:R/S:C/C:L/I:L/A:N
CVE-2024-48119	Vtiger CRM v8.2.0 has a HTML Injection vulnerability in the module parameter. Authenticated users can inject arbitrary HTML.	CVSS:3.1/AV:N/AC:L/PR:L/UI:R/S:C/C:L/I:L/A:N
CVE-2024-6959	A vulnerability in parisneo/lollms-webui version 9.8 allows for a Denial of Service (DOS) attack when uploading an audio file. If an attacker appends a large number of characters to the end of a multipart boundary, the system will continuously process each character, rendering lollms-webui inaccessible. This issue is exacerbated by the lack of Cross-Site Request Forgery (CSRF) protection, enabling remote exploitation. The vulnerability leads to service disruption, resource exhaustion, and extended downtime.	CVSS:3.1/AV:N/AC:L/PR:N/UI:R/S:U/C:N/I:L/A:H
CVE-2024-47636	Deserialization of Untrusted Data vulnerability in Eyecix JobSearch allows Object Injection.This issue affects JobSearch: from n/a through 2.5.9.	CVSS:3.1/AV:N/AC:L/PR:N/UI:N/S:U/C:H/I:H/A:H
CVE-2024-9793	A vulnerability classified as critical was found in Tenda AC1206 up to 15.03.06.23. This vulnerability affects the function ate_iwpriv_set/ate_ifconfig_set of the file /goform/ate. The manipulation leads to command injection. The attack can be initiated remotely. The exploit has been disclosed to the public and may be used. The vendor was contacted early about this disclosure but did not respond in any way.	CVSS:3.1/AV:N/AC:L/PR:N/UI:N/S:U/C:H/I:H/A:H
CVE-2024-7038	An information disclosure vulnerability exists in open-webui version 0.3.8. The vulnerability is related to the embedding model update feature under admin settings. When a user updates the model path, the system checks if the file exists and provides different error messages based on the existence and configuration of the file. This behavior allows an attacker to enumerate file names and traverse directories by observing the error messages, leading to potential exposure of sensitive information.	CVSS:3.1/AV:N/AC:L/PR:H/UI:N/S:U/C:L/I:N/A:N
CVE-2024-9675	A vulnerability was found in Buildah. Cache mounts do not properly validate that user-specified paths for the cache are within our cache directory, allowing a `RUN` instruction in a Container file to mount an arbitrary directory from the host (read/write) into the container as long as those files can be accessed by the user running Buildah.	CVSS:3.1/AV:L/AC:L/PR:L/UI:N/S:U/C:L/I:L/A:N
CVE-2024-45231	An issue was discovered in Django v5.1.1, v5.0.9, and v4.2.16. The django.contrib.auth.forms.PasswordResetForm class, when used in a view implementing password reset flows, allows remote attackers to enumerate user e-mail addresses by sending password reset requests and observing the outcome (only when e-mail sending is consistently failing).	CVSS:3.1/AV:N/AC:L/PR:N/UI:N/S:U/C:L/I:N/A:N
CVE-2024-45230	An issue was discovered in Django 5.1 before 5.1.1, 5.0 before 5.0.9, and 4.2 before 4.2.16. The urlize() and urlizetrunc() template filters are subject to a potential denial-of-service attack via very large inputs with a specific sequence of characters.	CVSS:3.1/AV:N/AC:L/PR:N/UI:N/S:U/C:N/I:N/A:H
CVE-2024-34669	Out-of-bounds write in parsing h.263+ format in librtppayload.so prior to SMR Oct-2024 Release 1 allows remote attackers to execute arbitrary code with system privilege. User interaction is required for triggering this vulnerability.	CVSS:3.1/AV:N/AC:L/PR:N/UI:R/S:U/C:H/I:H/A:H
CVE-2024-34668	Out-of-bounds write in parsing h.263 format in librtppayload.so prior to SMR Oct-2024 Release 1 allows remote attackers to execute arbitrary code with system privilege. User interaction is required for triggering this vulnerability.	CVSS:3.1/AV:N/AC:L/PR:N/UI:R/S:U/C:H/I:H/A:H
CVE-2024-34667	Out-of-bounds write in parsing h.265 format in librtppayload.so prior to SMR Oct-2024 Release 1 allows remote attackers to execute arbitrary code with system privilege. User interaction is required for triggering this vulnerability.	CVSS:3.1/AV:N/AC:L/PR:N/UI:R/S:U/C:H/I:H/A:H
CVE-2024-34666	Out-of-bounds write in parsing h.264 format in a specific mode in librtppayload.so prior to SMR Oct-2024 Release 1 allows remote attackers to execute arbitrary code with system privilege. User interaction is required for triggering this vulnerability.	CVSS:3.1/AV:N/AC:L/PR:N/UI:R/S:U/C:H/I:H/A:H
CVE-2024-34665	Out-of-bounds write in parsing h.264 format in librtppayload.so prior to SMR Oct-2024 Release 1 allows remote attackers to execute arbitrary code with system privilege. User interaction is required for triggering this vulnerability.	CVSS:3.1/AV:N/AC:L/PR:N/UI:R/S:U/C:H/I:H/A:H
CVE-2024-43684	Cross-Site Request Forgery (CSRF) vulnerability in Microchip TimeProvider 4100 allows Cross Site Request Forgery, Cross-Site Scripting (XSS).This issue affects TimeProvider 4100: from 1.0.	CVSS:3.1/AV:N/AC:L/PR:N/UI:R/S:U/C:H/I:H/A:H
CVE-2024-43683	URL Redirection to Untrusted Site ('Open Redirect') vulnerability in Microchip TimeProvider 4100 allows XSS Through HTTP Headers.This issue affects TimeProvider 4100: from 1.0.	CVSS:3.1/AV:N/AC:L/PR:N/UI:R/S:C/C:L/I:L/A:N
CVE-2023-37822	The Eufy Homebase 2 before firmware version 3.3.4.1h creates a dedicated wireless network for its ecosystem, which serves as a proxy to the end user's primary network. The WPA2-PSK generation of this dedicated network is flawed and solely based on the serial number. Due to the flawed generation process, the WPA2-PSK can be brute forced offline within seconds. This vulnerability allows an attacker in proximity to the dedicated wireless network to gain unauthorized access to the end user's primary network. The only requirement of the attack is proximity to the dedicated wireless network.	CVSS:3.1/AV:A/AC:L/PR:N/UI:N/S:C/C:H/I:L/A:N
CVE-2024-7826	Improper Check for Unusual or Exceptional Conditions vulnerability in Webroot SecureAnywhere - Web Shield on Windows, ARM, 64 bit, 32 bit (wrURL.Dll modules) allows Functionality Misuse.This issue affects SecureAnywhere - Web Shield: before 2.1.2.3.	CVSS:3.1/AV:N/AC:L/PR:N/UI:N/S:U/C:H/I:H/A:H
CVE-2024-7825	Access of Resource Using Incompatible Type ('Type Confusion') vulnerability in Webroot SecureAnywhere - Web Shield on Windows, ARM, 64 bit, 32 bit (wrUrl.Dll modules) allows Functionality Misuse.This issue affects SecureAnywhere - Web Shield: before 2.1.2.3.	CVSS:3.1/AV:N/AC:L/PR:N/UI:N/S:U/C:H/I:H/A:H
CVE-2024-7824	Access of Resource Using Incompatible Type ('Type Confusion') vulnerability in Webroot SecureAnywhere - Web Shield on Windows, ARM, 64 bit, 32 bit (wrUrl.Dll modules) allows Functionality Misuse.This issue affects SecureAnywhere - Web Shield: before 2.1.2.3.	CVSS:3.1/AV:N/AC:L/PR:N/UI:N/S:U/C:H/I:H/A:H
CVE-2024-46977	OpenC3 COSMOS provides the functionality needed to send commands to and receive data from one or more embedded systems. A path traversal vulnerability inside of LocalMode's open_local_file method allows an authenticated user with adequate permissions to download any .txt via the ScreensController#show on the web server COSMOS is running on (depending on the file permissions). This vulnerability is fixed in 5.19.0.	CVSS:3.1/AV:N/AC:L/PR:L/UI:N/S:U/C:H/I:N/A:N
CVE-2024-43795	OpenC3 COSMOS provides the functionality needed to send commands to and receive data from one or more embedded systems. The login functionality contains a reflected cross-site scripting (XSS) vulnerability. This vulnerability is fixed in 5.19.0. Note: This CVE only affects Open Source Edition, and not OpenC3 COSMOS Enterprise Edition.	CVSS:3.1/AV:N/AC:L/PR:N/UI:R/S:C/C:L/I:L/A:N
CVE-2024-9355	A vulnerability was found in Golang FIPS OpenSSL. This flaw allows a malicious user to randomly cause an uninitialized buffer length variable with a zeroed buffer to be returned in FIPS mode. It may also be possible to force a false positive match between non-equal hashes when comparing a trusted computed hmac sum to an untrusted input sum if an attacker can send a zeroed buffer in place of a pre-computed sum.  It is also possible to force a derived key to be all zeros instead of an unpredictable value.  This may have follow-on implications for the Go TLS stack.	CVSS:3.1/AV:L/AC:H/PR:L/UI:N/S:U/C:H/I:H/A:L
CVE-2024-9341	A flaw was found in Go. When FIPS mode is enabled on a system, container runtimes may incorrectly handle certain file paths due to improper validation in the containers/common Go library. This flaw allows an attacker to exploit symbolic links and trick the system into mounting sensitive host directories inside a container. This issue also allows attackers to access critical host files, bypassing the intended isolation between containers and the host system.	CVSS:3.1/AV:N/AC:H/PR:L/UI:R/S:U/C:H/I:L/A:N
CVE-2024-9399	A website configured to initiate a specially crafted WebTransport session could crash the Firefox process leading to a denial of service condition. This vulnerability affects Firefox < 131, Firefox ESR < 128.3, Thunderbird < 128.3, and Thunderbird < 131.	CVSS:3.1/AV:N/AC:L/PR:N/UI:N/S:U/C:N/I:N/A:H
CVE-2024-9398	By checking the result of calls to `window.open` with specifically set protocol handlers, an attacker could determine if the application which implements that protocol handler is installed. This vulnerability affects Firefox < 131, Firefox ESR < 128.3, Thunderbird < 128.3, and Thunderbird < 131.	CVSS:3.1/AV:N/AC:L/PR:N/UI:N/S:U/C:L/I:N/A:N
CVE-2024-9394	"An attacker could, via a specially crafted multipart response, execute arbitrary JavaScript under the `resource://devtools` origin.  This could allow them to access cross-origin JSON content. This access is limited to ""same site"" documents by the Site Isolation feature on desktop clients, but full cross-origin access is possible on Android versions. This vulnerability affects Firefox < 131, Firefox ESR < 128.3, Firefox ESR < 115.16, Thunderbird < 128.3, and Thunderbird < 131."	CVSS:3.1/AV:N/AC:L/PR:N/UI:N/S:U/C:H/I:N/A:N
CVE-2024-9393	"An attacker could, via a specially crafted multipart response, execute arbitrary JavaScript under the `resource://pdf.js` origin.  This could allow them to access cross-origin PDF content. This access is limited to ""same site"" documents by the Site Isolation feature on desktop clients, but full cross-origin access is possible on Android versions. This vulnerability affects Firefox < 131, Firefox ESR < 128.3, Firefox ESR < 115.16, Thunderbird < 128.3, and Thunderbird < 131."	CVSS:3.1/AV:N/AC:L/PR:N/UI:N/S:U/C:H/I:N/A:N
CVE-2024-47172	Computer Vision Annotation Tool (CVAT) is an interactive video and image annotation tool for computer vision. An attacker with a CVAT account may retrieve certain information about any project, task, job or membership resource on the CVAT instance. The information exposed in this way is the same as the information returned on a GET request to the resource. In addition, the attacker can also alter the default source and target storage associated with any project or task. Upgrade to CVAT 2.19.1 or any later version to fix the issue.	CVSS:3.1/AV:N/AC:L/PR:L/UI:N/S:U/C:L/I:L/A:N
CVE-2024-47064	Computer Vision Annotation Tool (CVAT) is an interactive video and image annotation tool for computer vision. If an attacker can trick a logged-in CVAT user into visiting a maliciously-constructed URL, they can initiate any API calls on that user's behalf. This gives the attacker temporary access to all data that the victim user has access to. Upgrade to CVAT 2.19.0 or a later version to fix this issue.	CVSS:3.1/AV:N/AC:L/PR:N/UI:R/S:C/C:L/I:L/A:N
CVE-2024-47063	Computer Vision Annotation Tool (CVAT) is an interactive video and image annotation tool for computer vision. If a malicious CVAT user with permissions to either create a task, or edit an existing task can trick another logged-in user into visiting a maliciously-constructed URL, they can initiate any API calls on that user's behalf. This gives the attacker temporary access to all data that the victim user has access to. Upgrade to CVAT 2.19.0 or a later version to fix this issue.	CVSS:3.1/AV:N/AC:L/PR:N/UI:R/S:C/C:L/I:L/A:N
CVE-2024-47171	Agnai is an artificial-intelligence-agnostic multi-user, mult-bot roleplaying chat system. A vulnerability in versions prior to 1.0.330 permits attackers to upload image files at attacker-chosen location on the server. This issue can lead to image file uploads to unauthorized or unintended directories, including overwriting of existing images which may be used for defacement. This does not affect `agnai.chat`, installations using S3-compatible storage, or self-hosting that is not publicly exposed. Version 1.0.330 fixes this vulnerability.	CVSS:3.1/AV:N/AC:L/PR:L/UI:N/S:U/C:N/I:L/A:N
CVE-2024-47170	Agnai is an artificial-intelligence-agnostic multi-user, mult-bot roleplaying chat system. A vulnerability in versions prior to 1.0.330 permits attackers to read arbitrary JSON files at attacker-chosen locations on the server. This issue can lead to unauthorized access to sensitive information and exposure of confidential configuration files. This only affects installations with `JSON_STORAGE` enabled which is intended to local/self-hosting only. Version 1.0.330 fixes this issue.	CVSS:3.1/AV:N/AC:L/PR:L/UI:N/S:U/C:L/I:N/A:N
CVE-2024-47169	Agnai is an artificial-intelligence-agnostic multi-user, mult-bot roleplaying chat system. A vulnerability in versions prior to 1.0.330 permits attackers to upload arbitrary files to attacker-chosen locations on the server, including JavaScript, enabling the execution of commands within those files. This issue could result in unauthorized access, full server compromise, data leakage, and other critical security threats. This does not affect `agnai.chat`, installations using S3-compatible storage, or self-hosting that is not publicly exposed. This does affect publicly hosted installs without S3-compatible storage. Version 1.0.330 fixes this vulnerability.	CVSS:3.1/AV:N/AC:L/PR:L/UI:N/S:U/C:H/I:H/A:H
CVE-2024-47121	"The goTenna Pro App uses a weak password for sharing encryption keys via
 the key broadcast method. If the broadcasted encryption key is captured
 over RF, and password is cracked via brute force attack, it is possible
 to decrypt it and use it to decrypt all future and past messages sent 
via encrypted broadcast with that particular key. This only applies when
 the key is broadcasted over RF. This is an optional feature, so it is 
