CVE ID	Description	CVSS Vector
CVE-2024-38424	Memory corruption during GNSS HAL process initialization.	CVSS:3.1/AV:L/AC:L/PR:L/UI:N/S:U/C:H/I:H/A:H
CVE-2024-38423	Memory corruption while processing GPU page table switch.	CVSS:3.1/AV:L/AC:L/PR:L/UI:N/S:U/C:H/I:H/A:H
CVE-2024-38422	Memory corruption while processing voice packet with arbitrary data received from ADSP.	CVSS:3.1/AV:L/AC:L/PR:L/UI:N/S:U/C:H/I:H/A:H
CVE-2024-38421	Memory corruption while processing GPU commands.	CVSS:3.1/AV:L/AC:L/PR:L/UI:N/S:U/C:H/I:H/A:H
CVE-2024-38419	Memory corruption while invoking IOCTL calls from the use-space for HGSL memory node.	CVSS:3.1/AV:L/AC:L/PR:L/UI:N/S:U/C:H/I:H/A:H
CVE-2024-38415	Memory corruption while handling session errors from firmware.	CVSS:3.1/AV:L/AC:L/PR:L/UI:N/S:U/C:H/I:H/A:H
CVE-2024-38409	Memory corruption while station LL statistic handling.	CVSS:3.1/AV:L/AC:L/PR:L/UI:N/S:U/C:H/I:H/A:H
CVE-2024-38408	Cryptographic issue when a controller receives an LMP start encryption command under unexpected conditions.	CVSS:3.1/AV:N/AC:L/PR:N/UI:N/S:U/C:H/I:L/A:N
CVE-2024-38407	Memory corruption while processing input parameters for any IOCTL call in the JPEG Encoder driver.	CVSS:3.1/AV:L/AC:L/PR:L/UI:N/S:U/C:H/I:H/A:H
CVE-2024-38406	Memory corruption while handling IOCTL calls in JPEG Encoder driver.	CVSS:3.1/AV:L/AC:L/PR:L/UI:N/S:U/C:H/I:H/A:H
CVE-2024-38405	Transient DOS while processing the CU information from RNR IE.	CVSS:3.1/AV:N/AC:L/PR:N/UI:N/S:U/C:N/I:N/A:H
CVE-2024-38403	Transient DOS while parsing BTM ML IE when per STA profile is not included.	CVSS:3.1/AV:N/AC:L/PR:N/UI:N/S:U/C:N/I:N/A:H
CVE-2024-33068	Transient DOS while parsing fragments of MBSSID IE from beacon frame.	CVSS:3.1/AV:N/AC:L/PR:N/UI:N/S:U/C:N/I:N/A:H
CVE-2024-33033	Memory corruption while processing IOCTL calls to unmap the buffers.	CVSS:3.1/AV:L/AC:L/PR:H/UI:N/S:U/C:H/I:H/A:H
CVE-2024-33032	Memory corruption when the user application modifies the same shared memory asynchronously when kernel is accessing it.	CVSS:3.1/AV:L/AC:L/PR:H/UI:N/S:U/C:H/I:H/A:H
CVE-2024-33031	Memory corruption while processing the update SIM PB records request.	CVSS:3.1/AV:L/AC:L/PR:H/UI:N/S:U/C:H/I:H/A:H
CVE-2024-33030	Memory corruption while parsing IPC frequency table parameters for LPLH that has size greater than expected size.	CVSS:3.1/AV:L/AC:L/PR:H/UI:N/S:U/C:H/I:H/A:H
CVE-2024-23386	memory corruption when WiFi display APIs are invoked with large random inputs.	CVSS:3.1/AV:L/AC:L/PR:H/UI:N/S:U/C:H/I:H/A:H
CVE-2024-23385	Transient DOS as modem reset occurs when an unexpected MAC RAR (with invalid PDU length) is seen at UE.	CVSS:3.1/AV:N/AC:L/PR:N/UI:N/S:U/C:N/I:N/A:H
CVE-2024-10698	A vulnerability was found in Tenda AC6 15.03.05.19 and classified as critical. Affected by this issue is the function formSetDeviceName of the file /goform/SetOnlineDevName. The manipulation of the argument devName leads to stack-based buffer overflow. The attack may be launched remotely. The exploit has been disclosed to the public and may be used.	CVSS:3.1/AV:N/AC:L/PR:N/UI:N/S:U/C:H/I:H/A:H
CVE-2024-10697	A vulnerability has been found in Tenda AC6 15.03.05.19 and classified as critical. Affected by this vulnerability is the function formWriteFacMac of the file /goform/WriteFacMac of the component API Endpoint. The manipulation of the argument The leads to command injection. The attack can be launched remotely. The exploit has been disclosed to the public and may be used.	CVSS:3.1/AV:N/AC:L/PR:N/UI:N/S:U/C:H/I:H/A:H
CVE-2024-9896	The BBP Core – Expand bbPress powered forums with useful features plugin for WordPress is vulnerable to Reflected Cross-Site Scripting due to the use of add_query_arg without appropriate escaping on the URL in all versions up to, and including, 1.2.5. This makes it possible for unauthenticated attackers to inject arbitrary web scripts in pages that execute if they can successfully trick a user into performing an action such as clicking on a link.	CVSS:3.1/AV:N/AC:L/PR:N/UI:R/S:C/C:L/I:L/A:N
CVE-2024-51774	qBittorrent before 5.0.1 proceeds with use of https URLs even after certificate validation errors.	CVSS:3.1/AV:N/AC:H/PR:N/UI:N/S:U/C:H/I:H/A:H
CVE-2024-9868	The Element Pack Elementor Addons (Header Footer, Template Library, Dynamic Grid & Carousel, Remote Arrows) plugin for WordPress is vulnerable to Stored Cross-Site Scripting via the Age Gate Widget 'url' parameter in all versions up to, and including, 5.10.1 due to insufficient input sanitization and output escaping. This makes it possible for authenticated attackers, with Contributor-level access and above, to inject arbitrary web scripts in pages that will execute whenever a user accesses an injected page.	CVSS:3.1/AV:N/AC:L/PR:L/UI:R/S:C/C:L/I:L/A:N
CVE-2024-8739	The ReCaptcha Integration for WordPress plugin for WordPress is vulnerable to Reflected Cross-Site Scripting due to the use of add_query_arg without appropriate escaping on the URL in all versions up to, and including, 1.2.5. This makes it possible for unauthenticated attackers to inject arbitrary web scripts in pages that execute if they can successfully trick a user into performing an action such as clicking on a link.	CVSS:3.1/AV:N/AC:L/PR:N/UI:R/S:C/C:L/I:L/A:N
CVE-2024-10540	The Appointment Booking Calendar Plugin and Scheduling Plugin – BookingPress plugin for WordPress is vulnerable to SQL Injection via the 'service' parameter of the bookingpress_form shortcode in all versions up to, and including, 1.1.16 due to insufficient escaping on the user supplied parameter and lack of sufficient preparation on the existing SQL query.  This makes it possible for authenticated attackers, with Subscriber-level access and above, to append additional SQL queries into already existing queries that can be used to extract sensitive information from the database.	CVSS:3.1/AV:N/AC:L/PR:L/UI:N/S:U/C:H/I:N/A:N
CVE-2024-10310	The Element Pack Elementor Addons (Header Footer, Template Library, Dynamic Grid & Carousel, Remote Arrows) plugin for WordPress is vulnerable to Stored Cross-Site Scripting via the Custom Gallery Widget 'image_title' parameter in all versions up to, and including, 5.10.1 due to insufficient input sanitization and output escaping. This makes it possible for authenticated attackers, with Contributor-level access and above, to inject arbitrary web scripts in pages that will execute whenever a user accesses an injected page.	CVSS:3.1/AV:N/AC:L/PR:L/UI:R/S:C/C:L/I:L/A:N
CVE-2024-44234	The issue was addressed with improved bounds checks. This issue is fixed in macOS Sonoma 14.7.1, macOS Ventura 13.7.1, visionOS 2.1, watchOS 11.1, tvOS 18.1, iOS 17.7.1 and iPadOS 17.7.1, iOS 18.1 and iPadOS 18.1. Parsing a maliciously crafted video file may lead to unexpected system termination.	CVSS:3.1/AV:L/AC:L/PR:N/UI:R/S:U/C:N/I:N/A:H
CVE-2024-44233	The issue was addressed with improved bounds checks. This issue is fixed in macOS Sonoma 14.7.1, macOS Ventura 13.7.1, visionOS 2.1, watchOS 11.1, tvOS 18.1, iOS 17.7.1 and iPadOS 17.7.1, iOS 18.1 and iPadOS 18.1. Parsing a maliciously crafted video file may lead to unexpected system termination.	CVSS:3.1/AV:L/AC:L/PR:N/UI:R/S:U/C:N/I:N/A:H
CVE-2024-44232	The issue was addressed with improved bounds checks. This issue is fixed in macOS Sonoma 14.7.1, macOS Ventura 13.7.1, visionOS 2.1, watchOS 11.1, tvOS 18.1, iOS 17.7.1 and iPadOS 17.7.1, iOS 18.1 and iPadOS 18.1. Parsing a maliciously crafted video file may lead to unexpected system termination.	CVSS:3.1/AV:L/AC:L/PR:N/UI:R/S:U/C:N/I:N/A:H
CVE-2024-41745	IBM CICS TX Standard is vulnerable to cross-site scripting. This vulnerability allows an unauthenticated attacker to embed arbitrary JavaScript code in the Web UI thus altering the intended functionality potentially leading to credentials disclosure within a trusted session.	CVSS:3.1/AV:N/AC:L/PR:N/UI:R/S:C/C:L/I:L/A:N
CVE-2024-41744	IBM CICS TX Standard 11.1 is vulnerable to cross-site request forgery which could allow an attacker to execute malicious and unauthorized actions transmitted from a user that the website trusts.	CVSS:3.1/AV:N/AC:L/PR:N/UI:R/S:U/C:N/I:H/A:N
CVE-2024-41741	IBM TXSeries for Multiplatforms 10.1 could allow an attacker to determine valid usernames due to an observable timing discrepancy which could be used in further attacks against the system.	CVSS:3.1/AV:N/AC:L/PR:N/UI:N/S:U/C:L/I:N/A:N
CVE-2024-10367	The Otter Blocks – Gutenberg Blocks, Page Builder for Gutenberg Editor & FSE plugin for WordPress is vulnerable to Stored Cross-Site Scripting via REST API SVG File uploads in all versions up to, and including, 3.0.4 due to insufficient input sanitization and output escaping. This makes it possible for authenticated attackers, with Author-level access and above, to inject arbitrary web scripts in pages that will execute whenever a user accesses the SVG file.	CVSS:3.1/AV:N/AC:L/PR:L/UI:N/S:C/C:L/I:L/A:N
CVE-2024-10652	IDExpert from CHANGING Information Technology does not properly validate a parameter for a specific functionality, allowing unauthenticated remote attackers to inject JavsScript code and perform Reflected Cross-site scripting attacks.	CVSS:3.1/AV:N/AC:L/PR:N/UI:R/S:C/C:L/I:L/A:N
CVE-2024-10651	IDExpert from CHANGING Information Technology does not properly validate a specific parameter in the administrator interface, allowing remote attackers with administrator privileges to exploit this vulnerability to read arbitrary system files.	CVSS:3.1/AV:N/AC:L/PR:H/UI:N/S:U/C:H/I:N/A:N
CVE-2024-10232	The Group Chat & Video Chat by AtomChat plugin for WordPress is vulnerable to Stored Cross-Site Scripting via the plugin's atomchat shortcode in all versions up to, and including, 1.1.5 due to insufficient input sanitization and output escaping on user supplied attributes. This makes it possible for authenticated attackers, with contributor-level access and above, to inject arbitrary web scripts in pages that will execute whenever a user accesses an injected page.	CVSS:3.1/AV:N/AC:L/PR:L/UI:N/S:C/C:L/I:L/A:N
CVE-2024-9655	The Gutenberg Blocks with AI by Kadence WP – Page Builder Features plugin for WordPress is vulnerable to Stored Cross-Site Scripting via the plugin's Icon widget in all versions up to, and including, 6.6.2 due to insufficient input sanitization and output escaping on user supplied attributes. This makes it possible for authenticated attackers, with contributor-level access and above, to inject arbitrary web scripts in pages that will execute whenever a user accesses an injected page.	CVSS:3.1/AV:N/AC:L/PR:L/UI:N/S:C/C:L/I:L/A:N
CVE-2024-7424	The Multiple Page Generator Plugin – MPG plugin for WordPress is vulnerable to unauthorized modification of and access to data due to a missing capability check on several functions in all versions up to, and including, 4.0.1. This makes it possible for authenticated attackers, with Subscriber-level access and above, to invoke those functions intended for admin use resulting in subscribers being able to upload csv files and view the contents of MPG projects.	CVSS:3.1/AV:N/AC:L/PR:L/UI:N/S:U/C:L/I:L/A:N
CVE-2024-6480	The SIP Reviews Shortcode for WooCommerce plugin for WordPress is vulnerable to Stored Cross-Site Scripting via the 'no_of_reviews' attribute in the woocommerce_reviews shortcode in all versions up to, and including, 1.2.3 due to insufficient input sanitization and output escaping on user supplied attributes. This makes it possible for authenticated attackers, with contributor-level access and above, to inject arbitrary web scripts in pages that will execute whenever a user accesses an injected page.	CVSS:3.1/AV:N/AC:L/PR:L/UI:N/S:C/C:L/I:L/A:N
CVE-2024-10595	A vulnerability was found in ESAFENET CDG 5. It has been declared as critical. Affected by this vulnerability is the function delFile/delDifferCourseList of the file /com/esafenet/servlet/ajax/PublicDocInfoAjax.java. The manipulation leads to sql injection. The attack can be launched remotely. The exploit has been disclosed to the public and may be used. The vendor was contacted early about this disclosure but did not respond in any way.	CVSS:3.1/AV:N/AC:L/PR:N/UI:N/S:U/C:H/I:H/A:H
CVE-2024-10573	An out-of-bounds write flaw was found in mpg123 when handling crafted streams. When decoding PCM, the libmpg123 may write past the end of a heap-located buffer. Consequently, heap corruption may happen, and arbitrary code execution is not discarded. The complexity required to exploit this flaw is considered high as the payload must be validated by the MPEG decoder and the PCM synth before execution. Additionally, to successfully execute the attack, the user must scan through the stream, making web live stream content (such as web radios) a very unlikely attack vector.	CVSS:3.1/AV:L/AC:H/PR:L/UI:R/S:U/C:H/I:H/A:H
CVE-2024-8553	A vulnerability was found in Foreman's loader macros introduced with report templates. These macros may allow an authenticated user with permissions to view and create templates to read any field from Foreman's database. By using specific strings in the loader macros, users can bypass permissions and access sensitive information.	CVSS:3.1/AV:N/AC:L/PR:L/UI:N/S:U/C:L/I:L/A:L
CVE-2024-9446	The WP Simple Anchors Links plugin for WordPress is vulnerable to Stored Cross-Site Scripting via the plugin's wpanchor shortcode in all versions up to, and including, 1.0.0 due to insufficient input sanitization and output escaping on user supplied attributes. This makes it possible for authenticated attackers, with contributor-level access and above, to inject arbitrary web scripts in pages that will execute whenever a user accesses an injected page.	CVSS:3.1/AV:N/AC:L/PR:L/UI:N/S:C/C:L/I:L/A:N
CVE-2024-9434	The WPGlobus Translate Options plugin for WordPress is vulnerable to Cross-Site Request Forgery in all versions up to, and including, 2.2.0. This is due to missing or incorrect nonce validation on the on__translate_options_page() function. This makes it possible for unauthenticated attackers to inject malicious web scripts and update plugin settings via a forged request granted they can trick a site administrator into performing an action such as clicking on a link.	CVSS:3.1/AV:N/AC:L/PR:N/UI:R/S:C/C:L/I:L/A:N
CVE-2024-9430	The Get Quote For Woocommerce – Request A Quote For Woocommerce plugin for WordPress is vulnerable to unauthorized access of Quote data due to a missing capability check on the ct_tepfw_wp_loaded function in all versions up to, and including, 1.0.0. This makes it possible for unauthenticated attackers to download Quote PDF and CSV documents.	CVSS:3.1/AV:N/AC:L/PR:N/UI:N/S:U/C:L/I:N/A:N
CVE-2024-9165	The Gift Cards (Gift Vouchers and Packages) (WooCommerce Supported) plugin for WordPress is vulnerable to Stored Cross-Site Scripting via SVG File uploads in all versions up to, and including, 4.4.4 due to insufficient input sanitization and output escaping. This makes it possible for authenticated attackers, with Author-level access and above, to inject arbitrary web scripts in pages that will execute whenever a user accesses the SVG file.	CVSS:3.1/AV:N/AC:L/PR:L/UI:N/S:C/C:L/I:L/A:N
CVE-2024-9700	The Forminator Forms – Contact Form, Payment Form & Custom Form Builder plugin for WordPress is vulnerable to Insecure Direct Object Reference in all versions up to, and including, 1.36.0 via the submit_quizzes() function due to missing validation on the 'entry_id' user controlled key. This makes it possible for unauthenticated attackers to modify other user's quiz submissions.	CVSS:3.1/AV:N/AC:L/PR:N/UI:N/S:U/C:N/I:L/A:N
CVE-2024-10392	The AI Power: Complete AI Pack plugin for WordPress is vulnerable to arbitrary file uploads due to missing file type validation in the 'handle_image_upload' function in all versions up to, and including, 1.8.89. This makes it possible for unauthenticated attackers to upload arbitrary files on the affected site's server which may make remote code execution possible.	CVSS:3.1/AV:N/AC:L/PR:N/UI:N/S:U/C:H/I:H/A:H
CVE-2024-9708	The Easy SVG Upload plugin for WordPress is vulnerable to Stored Cross-Site Scripting via SVG File uploads in all versions up to, and including, 1.0 due to insufficient input sanitization and output escaping. This makes it possible for authenticated attackers, with Author-level access and above, to inject arbitrary web scripts in pages that will execute whenever a user accesses the SVG file.	CVSS:3.1/AV:N/AC:L/PR:L/UI:N/S:C/C:L/I:L/A:N
CVE-2024-10561	A vulnerability was found in Codezips Pet Shop Management System 1.0. It has been classified as critical. This affects an unknown part of the file birdsupdate.php. The manipulation of the argument id leads to sql injection. It is possible to initiate the attack remotely. The exploit has been disclosed to the public and may be used.	CVSS:3.1/AV:N/AC:L/PR:N/UI:N/S:U/C:H/I:H/A:H
CVE-2024-10559	A vulnerability was found in SourceCodester Airport Booking Management System 1.0 and classified as critical. Affected by this issue is the function details of the component Passport Number Handler. The manipulation leads to buffer overflow. The attack needs to be approached locally. The exploit has been disclosed to the public and may be used.	CVSS:3.1/AV:L/AC:L/PR:L/UI:N/S:U/C:H/I:H/A:H
CVE-2024-10544	The Woo Manage Fraud Orders plugin for WordPress is vulnerable to Sensitive Information Exposure in all versions up to, and including, 6.1.7 through publicly exposed log files. This makes it possible for unauthenticated attackers to view potentially sensitive information about users contained in the exposed log files.	CVSS:3.1/AV:N/AC:L/PR:N/UI:N/S:U/C:L/I:N/A:N
CVE-2024-10557	A vulnerability has been found in code-projects Blood Bank Management System 1.0 and classified as problematic. Affected by this vulnerability is an unknown functionality of the file /file/updateprofile.php. The manipulation leads to cross-site request forgery. The attack can be launched remotely. The exploit has been disclosed to the public and may be used.	CVSS:3.1/AV:N/AC:L/PR:N/UI:R/S:U/C:N/I:H/A:N
CVE-2024-10556	A vulnerability, which was classified as critical, was found in Codezips Pet Shop Management System 1.0. Affected is an unknown function of the file birdsadd.php. The manipulation of the argument id leads to sql injection. It is possible to launch the attack remotely. The exploit has been disclosed to the public and may be used.	CVSS:3.1/AV:N/AC:L/PR:N/UI:N/S:U/C:H/I:H/A:H
CVE-2024-33700	The LevelOne WBR-6012 router firmware R0.40e6 suffers from an input validation vulnerability within its FTP functionality, enabling attackers to cause a denial of service through a series of malformed FTP commands. This can lead to device reboots and service disruption.	CVSS:3.1/AV:N/AC:L/PR:N/UI:N/S:U/C:N/I:N/A:H
CVE-2024-33699	The LevelOne WBR-6012 router's web application has a vulnerability in its firmware version R0.40e6, allowing attackers to change the administrator password and gain higher privileges without the current password.	CVSS:3.1/AV:N/AC:L/PR:L/UI:N/S:C/C:H/I:H/A:H
CVE-2024-33626	The LevelOne WBR-6012 router contains a vulnerability within its web application that allows unauthenticated disclosure of sensitive information, such as the WiFi WPS PIN, through a hidden page accessible by an HTTP request. Disclosure of this information could enable attackers to connect to the device's WiFi network.	CVSS:3.1/AV:N/AC:L/PR:N/UI:N/S:U/C:L/I:N/A:N
CVE-2024-33603	The LevelOne WBR-6012 router has an information disclosure vulnerability in its web application, which allows unauthenticated users to access a verbose system log page and obtain sensitive data, such as memory addresses and IP addresses for login attempts. This flaw could lead to session hijacking due to the device's reliance on IP address for authentication.	CVSS:3.1/AV:N/AC:L/PR:N/UI:N/S:U/C:L/I:N/A:N
CVE-2024-32946	A vulnerability in the LevelOne WBR-6012 router's firmware version R0.40e6 allows sensitive information to be transmitted in cleartext via Web and FTP services, exposing it to network sniffing attacks.	CVSS:3.1/AV:N/AC:H/PR:N/UI:N/S:U/C:H/I:N/A:N
CVE-2024-31152	The LevelOne WBR-6012 router with firmware R0.40e6 is vulnerable to improper resource allocation within its web application, where a series of crafted HTTP requests can cause a reboot. This could lead to network service interruptions.	CVSS:3.1/AV:N/AC:L/PR:N/UI:N/S:U/C:N/I:N/A:L
CVE-2024-31151	"A security flaw involving hard-coded credentials in LevelOne WBR-6012's web services allows attackers to gain unauthorized access during the first 30 seconds post-boot. Other vulnerabilities can force a reboot, circumventing the initial time restriction for exploitation.The password string can be found at addresses 0x 803cdd0f and 0x803da3e6:

    803cdd0f 41 72 69 65        ds         ""AriesSerenaCairryNativitaMegan""
             73 53 65 72 
             65 6e 61 43
             ...

It is referenced by the function at 0x800b78b0 and simplified in the pseudocode below:

    if (is_equal = strcmp(password,""AriesSerenaCairryNativitaMegan""){
        ret = 3;}

Where 3 is the return value to user-level access (0 being fail and 1 being admin/backdoor).

While there's no legitimate functionality to change this password, once authenticated it is possible manually make a change by taking advantage of TALOS-2024-XXXXX using HTTP POST paramater ""Pu"" (new user password) in place of ""Pa"" (new admin password)."	CVSS:3.1/AV:N/AC:H/PR:N/UI:N/S:U/C:H/I:H/A:H
CVE-2024-28875	"A security flaw involving hard-coded credentials in LevelOne WBR-6012's web services allows attackers to gain unauthorized access during the first 30 seconds post-boot. Other vulnerabilities can force a reboot, circumventing the initial time restriction for exploitation.The backdoor string can be found at address 0x80100910

    80100910 40 6d 21 74        ds         ""@m!t2K1""
             32 4b 31 00
             
It is referenced by the function located at 0x800b78b0 and is used as shown in the pseudocode below:

    if ((SECOND_FROM_BOOT_TIME < 300) &&
        (is_equal = strcmp(password,""@m!t2K1"")) {
            return 1;}
            
Where 1 is the return value to admin-level access (0 being fail and 3 being user)."	CVSS:3.1/AV:N/AC:H/PR:N/UI:N/S:U/C:H/I:H/A:H
CVE-2024-28052	The WBR-6012 is a wireless SOHO router. It is a low-cost device which functions as an internet gateway for homes and small offices while aiming to be easy to configure and operate. In addition to providing a WiFi access point, the device serves as a 4-port wired router and implements a variety of common SOHO router capabilities such as port forwarding, quality-of-service, web-based administration, a DHCP server, a basic DMZ, and UPnP capabilities.	CVSS:3.1/AV:N/AC:L/PR:N/UI:N/S:U/C:N/I:N/A:L
CVE-2024-23309	The LevelOne WBR-6012 router with firmware R0.40e6 has an authentication bypass vulnerability in its web application due to reliance on client IP addresses for authentication. Attackers could spoof an IP address to gain unauthorized access without needing a session token.	CVSS:3.1/AV:N/AC:H/PR:N/UI:N/S:C/C:H/I:H/A:H
CVE-2024-8512	The W3SPEEDSTER plugin for WordPress is vulnerable to Remote Code Execution in all versions up to, and including, 7.26 via the 'script' parameter of the hookBeforeStartOptimization() function. This is due to the plugin passing user supplied input to eval(). This makes it possible for authenticated attackers, with Administrator-level access and above, to execute code on the server.	CVSS:3.1/AV:N/AC:L/PR:H/UI:N/S:C/C:H/I:H/A:H
CVE-2024-9632	A flaw was found in the X.org server. Due to improperly tracked allocation size in _XkbSetCompatMap, a local attacker may be able to trigger a buffer overflow condition via a specially crafted payload, leading to denial of service or local privilege escalation in distributions where the X.org server is run with root privileges.	CVSS:3.1/AV:L/AC:L/PR:L/UI:N/S:U/C:H/I:H/A:H
CVE-2024-10223	The WP Team – WordPress Team Member Plugin plugin for WordPress is vulnerable to Stored Cross-Site Scripting via the plugin's htteamember shortcode in all versions up to, and including, 1.1.4 due to insufficient input sanitization and output escaping on user supplied attributes. This makes it possible for authenticated attackers, with contributor-level access and above, to inject arbitrary web scripts in pages that will execute whenever a user accesses an injected page.	CVSS:3.1/AV:N/AC:L/PR:L/UI:N/S:C/C:L/I:L/A:N
CVE-2024-10108	The WPAdverts – Classifieds Plugin plugin for WordPress is vulnerable to Stored Cross-Site Scripting via the plugin's adverts_add shortcode in all versions up to, and including, 2.1.6 due to insufficient input sanitization and output escaping. This makes it possible for unauthenticated attackers to inject arbitrary web scripts in pages that will execute whenever a user accesses an injected page.	CVSS:3.1/AV:N/AC:L/PR:N/UI:N/S:C/C:L/I:L/A:N
CVE-2024-8871	The Pricing Tables WordPress Plugin – Easy Pricing Tables plugin for WordPress is vulnerable to Reflected Cross-Site Scripting due to the use of add_query_arg without appropriate escaping on the URL in all versions up to, and including, 3.2.5. This makes it possible for unauthenticated attackers to inject arbitrary web scripts in pages that execute if they can successfully trick a user into performing an action such as clicking on a link.	CVSS:3.1/AV:N/AC:L/PR:N/UI:R/S:C/C:L/I:L/A:N
