question	Option_A 	Option_B	Option_C 	Option_D	Correct_Answer	Explanation
Given a scenario where an adversary is using Command and Control (C2) over Tor network (MITRE ATT&CK T1036), which Diamond Model feature is primarily affected?	Adversary	Infrastructure	Capability	Victim	B	The adversary may use various capabilities like T1036 to communicate, but it's the infrastructure (Tor network) that is directly impacted.
During an analysis of an intrusion, the analyst is trying to determine the potential number of victims (MITRE ATT&CK T1087). Which meta-feature of the Diamond Model would be most relevant to this process?	Timestamp	Phase	Direction	Victim	D	The Victim meta-feature, particularly Vulnerabilities and Exposures, is the most relevant to determining potential victims in an intrusion.
An analyst is investigating a suspected adversary campaign using the Diamond Model. Which step in the extended Diamond Model would help the analyst identify shared threat space among adversaries (MITRE ATT&CK T1034)?	Social-Political	Technology	Adversary-Victim Relationships	Contextual Indicators	C	The Social-Political meta-feature, specifically Shared Threat Space, helps in identifying commonalities among adversaries that may be involved in the same or related campaigns.
An analyst is examining a series of events using the Diamond Model. Which event meta-feature would help the analyst in recognizing patterns and linking events together into activity threads (MITRE ATT&CK T1057)?	Phase	Result	Methodology	Direction	A	The Phase meta-feature helps in identifying the sequence and progression of events, which is essential in linking events together into activity threads.
An analyst is investigating a suspected adversary campaign that leverages multiple capabilities (MITRE ATT&CK T1086). Which Diamond Model feature would be most relevant to understand the adversary's toolkit and techniques?	Adversary	Infrastructure	Capability	Victim	C	The Capability feature is most relevant to understanding the adversary's toolkit and techniques as it encompasses the various methods the adversary uses during an intrusion.
An analyst is analyzing an intrusion event using the Diamond Model and notices a significant delay between the initial compromise and the lateral movement (MITRE ATT&CK T1021) phase. Which event meta-feature would most likely contribute to this delay?	Timestamp	Phase	Methodology	Direction	A	The Timestamp meta-feature would provide information about when events occurred, which can suggest delays between initial compromise and lateral movement phases.
An analyst is investigating an intrusion event using the Diamond Model and wants to focus on the adversary's behavior and motivations. Which Centered Approach would be the most suitable for this analysis?	Victim-Centered Approach	Capability-Centered Approach	Adversary-Centered Approach	Social-Political-Centered Approach	C	To focus on the adversary's behavior and motivations, an Adversary-Centered Approach would be the most suitable as it focuses on understanding the adversary's tactics, techniques, and procedures (TTPs).
An analyst is working on an intrusion analysis and wants to identify patterns across multiple events, threads, and activity groups (MITRE ATT&CK T1057, T1087, T1059). Which Diamond Model feature would help the analyst in this process?	Adversary	Infrastructure	Capability	Activity Thread/Group	D	Activity Threads and Activity Groups help in identifying patterns across multiple events, which is essential in understanding the adversary's overall campaign or operation.
An analyst is investigating an intrusion event using the Diamond Model. Which meta-feature would help the analyst in understanding the specific techniques, tools, or resources the adversary used (MITRE ATT&CK T1059)?	Timestamp	Phase	Methodology	Resources	D	The Resources meta-feature provides information about the specific techniques, tools, or resources the adversary used during the intrusion.
An analyst is examining an intrusion event using the Diamond Model and wants to understand the adversary's underlying motivations and objectives (MITRE ATT&CK T1001). Which meta-feature would most likely contribute to this understanding?	Adversary	Infrastructure	Capability	Social-Political	D	The Social-Political meta-feature, particularly Persistent Adversary Relationships and Cyber-Victimology, can help in understanding the adversary's motivations and objectives as it provides context about the adversary's broader goals and associated actors.
In the Diamond Model, which feature helps in understanding the tools and methods used by an adversary during an intrusion?	Adversary	Infrastructure	Capability	Victim	C	The Capability feature in the Diamond Model is crucial for understanding the tools and methods used by an adversary, as it encompasses the techniques and tools they employ during an attack.
When analyzing a series of attacks, which meta-feature of the Diamond Model is most relevant for identifying the relationships and interactions between different events?	Phase	Direction	Methodology	Contextual Indicators	D	The Contextual Indicators meta-feature helps in identifying relationships and interactions between different events, providing a broader understanding of how various activities are connected.
What Diamond Model feature would an analyst focus on to understand how adversaries use infrastructure to execute their attacks?	Adversary	Infrastructure	Capability	Victim	B	Understanding the Infrastructure feature of the Diamond Model helps analyze how adversaries use infrastructure (such as servers, networks, or domains) to execute their attacks.
Which meta-feature would be most helpful in determining the timeline and sequence of an adversary's actions during an intrusion?	Phase	Timestamp	Methodology	Direction	B	The Timestamp meta-feature helps in determining the timeline and sequence of an adversary's actions by providing precise information about when different events occurred.
In the Diamond Model, which feature is essential for understanding the potential impact and consequences of an adversary's actions on the target?	Adversary	Infrastructure	Capability	Victim	D	The Victim feature is essential for understanding the potential impact and consequences of an adversary's actions on the target, as it focuses on how the attack affects the victim organization.
When investigating an intrusion, which Diamond Model feature would an analyst focus on to understand the adversary's long-term strategies and objectives?	Adversary	Infrastructure	Capability	Social-Political	A	The Adversary feature helps in understanding the long-term strategies and objectives of the adversary, providing insights into their overall goals and motivations.
Which meta-feature of the Diamond Model helps an analyst in correlating different indicators and understanding the broader context of an attack?	Methodology	Phase	Timestamp	Contextual Indicators	D	Contextual Indicators help in correlating different indicators and understanding the broader context of an attack by providing additional details about the attack environment and circumstances.
What Diamond Model feature would be most relevant for identifying and analyzing the specific technologies and systems used by an adversary?	Adversary	Infrastructure	Capability	Victim	B	The Infrastructure feature is most relevant for identifying and analyzing the specific technologies and systems used by an adversary, including the hardware and software components they exploit.
Which meta-feature of the Diamond Model provides insights into the timing and duration of an adversary's activities during an attack?	Phase	Timestamp	Methodology	Direction	B	The Timestamp meta-feature provides insights into the timing and duration of an adversary's activities, which is essential for understanding the progression and impact of the attack.
In analyzing a cyber attack, which Diamond Model feature would be crucial for understanding how an adversary interacts with and manipulates the victim’s environment?	Adversary	Infrastructure	Capability	Victim	D	The Victim feature is crucial for understanding how an adversary interacts with and manipulates the victim’s environment, providing insights into the specific impact and exploitation of the target.
Filename: diamond_part10_1.tsv:How does Adversary1 establish a proxy on NA1’s host?	Using a known zero-day exploit in the operating system	Installing a rogue certificate on the host's web server	Utilizing MITRE ATT&CK T1105 - Data from Local System (File and Directory Discovery)	Setting up a proxy chain to mask the source IP address	D	Adversary1 establishes a proxy on NA1’s host by setting up a proxy chain to mask the source IP address. This action is not related to known zero-day exploits, rogue certificates, or file and directory discovery.
"What is the purpose of Adversary1 searching for ""most important research ever"" on the proxy established on NA1’s host?"	To gain unauthorized access to the research	To find potential targets for spear-phishing	To conduct reconnaissance on NA1’s network infrastructure	To collect information on NA1’s system configuration	B	"Adversary1 searches for ""most important research ever"" on the proxy established on NA1’s host to find potential targets for spear-phishing. This action does not involve gaining unauthorized access, conducting reconnaissance on the network, or collecting information on the system configuration."
Which MITRE ATT&CK technique describes an adversary embedding payloads in images that activate only when double-clicked?	T1055	T1086	T1204	T1486	B
How does Adversary1 obtain the contact information for the Interesting Research Inc. Chief Research Officer?	By exploiting a vulnerability in the email server	By using OSINT techniques to find the information online	By analyzing the email contact list on NA1’s host	By sending a social engineering email to NA1 to gain access to the contact list	C	Adversary1 obtains the contact information for the Interesting Research Inc. Chief Research Officer by analyzing the email contact list on NA1’s host. This action does not involve exploiting a vulnerability, using OSINT techniques, or sending a social engineering email.
What is the payload in the spear-phish email sent to the Interesting Research Inc. Chief Research Officer?	A malicious attachment disguised as a research paper	A link to a compromised website hosting the malware	A convincing email pretending to be from a colleague requesting access to a sensitive document	A social engineering message designed to trick the recipient into revealing sensitive information	A	The payload in the spear-phish email sent to the Interesting Research Inc. Chief Research Officer is a malicious attachment disguised as a research paper. This action does not involve a link to a compromised website, a request for access to a sensitive document, or a social engineering message.
What does the unknown adversary do after scanning for vulnerable web servers, including Victim3?	Launches a denial-of-service attack on the discovered vulnerable servers	Installs a keylogger on Victim3’s server	Executes a known exploit on the discovered vulnerable server	Uses the discovered vulnerable servers as a relay for further attacks	C	After scanning for vulnerable web servers, including Victim3, the unknown adversary executes a known exploit on the discovered vulnerable server. This action does not involve launching a denial-of-service attack, installing a keylogger, or using the servers as a relay for further attacks.
What is the outcome of the exploited server, Victim3, establishing a remote shell to the adversary?	The adversary gains full control over Victim3’s server	The adversary can now access Victim3’s network resources	Victim3’s server becomes a bot in a botnet	The adversary can now execute arbitrary commands on Victim3’s server	D	The outcome of the exploited server, Victim3, establishing a remote shell to the adversary is that the adversary can now execute arbitrary commands on Victim3’s server. This action grants the adversary full control, access to network resources, and potentially turns Victim3’s server into a bot in a botnet, but these specific outcomes are not explicitly mentioned in the scenario.
What does the adversary do after consolidating infrastructure, processes, and capabilities to reduce cost?	Sells the stolen data to the highest bidder	Launches a ransomware attack on the victim organization	Uses the consolidated resources to pivot to new targets	Abandons the operation and moves on to the next one	C	After consolidating infrastructure, processes, and capabilities to reduce cost, the adversary uses the consolidated resources to pivot to new targets. This action does not involve selling the stolen data, launching a ransomware attack, or abandoning the operation.
Which MITRE ATT&CK technique is most relevant to Adversary1 establishing a proxy on NA1’s host?	T1086 - PowerShell	T1021 - Remote Services	T1087 - Proxy	T1078 - Web Shell	C	The most relevant MITRE ATT&CK technique to Adversary1 establishing a proxy on NA1’s host is T1087 - Proxy. This technique involves establishing a proxy to mask the source IP address, which is what Adversary1 does in the scenario. PowerShell, Remote Services, and Web Shell techniques are not directly related to establishing a proxy on a host.
What analytical process is referred to when establishing causal relationships between events within a single vertical adversary-victim activity thread?	Horizon Scanning	Vertical Correlation	Threat Hunting	Incident Response	B	Vertical correlation is the analytic process of identifying knowledge gaps, filling those gaps with new knowledge, and establishing causal relationships within a single vertical adversary-victim activity thread.
What does horizontal correlation in threat analysis help to identify?	All possible attack paths within a single network	The direct impact of an exploit on a single system	Common features and knowledge gaps across different threads	The root cause of a specific network vulnerability	C	Horizontal correlation in threat analysis helps identify common features and knowledge gaps across different threads, using knowledge from one thread to fill gaps in another.
How does an adversary typically establish persistence on a compromised system?	By using a rootkit to hide malicious processes	By creating a new user account with administrative privileges	By modifying the system's startup scripts to run malicious code	By encrypting data to prevent detection	B	The adversary typically establishes persistence on a compromised system by creating a new user account with administrative privileges, allowing continued access and control even if initial access is detected and removed.
What is the main purpose of lateral movement in an attack lifecycle?	To escalate privileges on the compromised system	To gain access to additional systems and resources within the network	To exfiltrate sensitive data from the network	To create backdoors for future access	B	The main purpose of lateral movement in an attack lifecycle is to gain access to additional systems and resources within the network, expanding the adversary’s control and capabilities within the targeted environment.
Which MITRE ATT&CK technique involves the use of legitimate tools for malicious purposes, often to evade detection?	T1059 - Command and Scripting Interpreter	T1071 - Application Layer Protocol	T1028 - Data Staged	T1070 - Indicator Removal	A	A legitimate technique used for malicious purposes to evade detection is T1059 - Command and Scripting Interpreter, which involves using built-in command interpreters or scripting languages to execute malicious commands.
What is the purpose of conducting a post-exploitation phase in a cyber attack?	To cover tracks and erase logs	To gather additional information and escalate privileges	To disrupt the victim's operations and cause damage	To establish a foothold for future access	B	The purpose of conducting a post-exploitation phase in a cyber attack is to gather additional information and escalate privileges, ensuring continued access and control over the compromised environment.
Which analytical method is used to identify and evaluate adversary behaviors and techniques based on their observable actions and patterns?	Tactical Analysis	Strategic Analysis	Operational Analysis	Technical Analysis	D	Technical Analysis is used to identify and evaluate adversary behaviors and techniques based on their observable actions and patterns, focusing on the technical aspects of how attacks are carried out.
What is the goal of using threat intelligence in the context of cyber defense?	To understand the financial impact of cyber attacks	To anticipate and prepare for future attacks by understanding adversary tactics, techniques, and procedures	To comply with regulatory requirements related to data protection	To analyze the performance of security tools and technologies	B	The goal of using threat intelligence in the context of cyber defense is to anticipate and prepare for future attacks by understanding adversary tactics, techniques, and procedures, enabling proactive defense measures.
Which MITRE ATT&CK technique involves the adversary using encrypted communication channels to evade detection?	T1071 - Application Layer Protocol	T1041 - Exfiltration Over Command and Control Channel	T1075 - Pass the Ticket	T1072 - Application Layer Protocol Abuse	A	The MITRE ATT&CK technique involving the use of encrypted communication channels to evade detection is T1071 - Application Layer Protocol, which includes using protocols like HTTPS or DNS to mask malicious traffic.
What is the primary objective of threat modeling in cybersecurity?	To assess the financial impact of cyber threats	To design security controls and measures based on identified risks and vulnerabilities	To evaluate the effectiveness of existing security tools	To measure the performance of the security team	B	The primary objective of threat modeling in cybersecurity is to design security controls and measures based on identified risks and vulnerabilities, helping to prevent and mitigate potential threats effectively.
Which Diamond Model feature focuses on the methods and tools used by adversaries to execute their attacks?	Adversary	Infrastructure	Capability	Victim	C	The Capability feature focuses on the methods and tools used by adversaries to execute their attacks, detailing the specific techniques and tools employed during an attack.
"What role does the ""Social-Political"" meta-feature play in threat analysis?"	It helps in identifying the technical aspects of an attack	It provides insights into the broader context of adversary motivations and relationships	It focuses on the financial impact of the attack	It assesses the effectiveness of the victim’s defenses	B	"The ""Social-Political"" meta-feature provides insights into the broader context of adversary motivations and relationships, helping to understand the larger factors influencing the attack and the adversary’s objectives."
Filename: diamond_part11_1.tsv:Identifying adversary preference through common elements across a campaign is:	A method of identifying an adversary's infrastructure.	A method of identifying an adversary's modus operandi.	A method of identifying an adversary's attack vector.	A method of identifying an adversary's targeted resources.	B	Identifying adversary preferences helps understand their modus operandi, revealing common tactics and techniques across campaigns.
A sub-graph of an activity thread which contains a subset of its features, allowing for matching against other threads, is:	A node in the MITRE ATT&CK matrix.	An adversary process.	A tactic in the MITRE ATT&CK matrix.	A technique in the MITRE ATT&CK matrix.	A	An adversary process includes specific actions that can be compared with other processes in various activity threads.
The ability to identify and articulate common adversary features and behaviors is powerful because:	It allows for the identification of an adversary's infrastructure.	It allows for the grouping of like-threads together which share similar processes.	It allows for the identification of an adversary's targeted resources.	It allows for the identification of an adversary's attack vector.	B	Groupings based on common processes enhance analysis by highlighting patterns that can lead to better threat identification and mitigation strategies.
An example of an adversary process derived from the activity thread illustrated in Figure 6 is:	A reconnaissance event which includes a web search for “network administrator”, followed by the delivery of an email with a trojanized attachment, followed by a specific and known exploit on the local machine, and finally an HTTP Post leaving the victim.	A weaponization event which includes a local exploit on the victim's machine, followed by the delivery of an email with a trojanized attachment, followed by a web search for “network administrator”.	An exploitation event which includes a web search for “network administrator”, followed by the delivery of an email with a trojanized attachment, followed by a local exploit on the victim's machine.	An installation event which includes a local exploit on the victim's machine, followed by an HTTP Post from the victim, followed by a web search for “network administrator”.	A	The sequence of actions in option A represents a logical adversary process where reconnaissance leads to exploitation.
Formally, adversary processes are deﬁned as:	Subsets of an activity thread that contain a strict order of events without intervening events.	Subsets of an activity thread that contain a subset of its features allowing for matching against other threads.	Subsets of an activity thread that contain a subset of its techniques allowing for matching against other threads.	Subsets of an activity thread that contain a strict order of events and subsets of its features allowing for matching against other threads.	B	This definition captures how adversary processes can be identified through specific features that facilitate comparison with other processes.
In the scenario, Event 10 in Figure 6 could list the following in the resources meta-feature: network access to send email, access to an email account, the target email address, the trojan malware to include in the email, and knowledge of their target to create an email which will bypass filters and entice the target to execute the malware. Which of the following is hypothesized as the source of the targeting information enabling the most enticing email to be sent to the correct target?	Event 7 (proxy access)	Event 8 (search results)	Event 9 (web research)	Event 11 (internal reconnaissance)	C	Search results (Event 8) are the most likely source for collecting specific targeting information that allows the email to be crafted effectively.
The ability to identify and document hypotheses is important because:	It allows for the identification of an adversary's infrastructure.	It allows for the grouping of like-threads together which share similar processes.	It allows for the identification of an adversary's targeted resources.	It allows for the identification and documentation of hypotheses, increasing the value and accuracy of the knowledge.	D	Documenting hypotheses helps to refine analysis by making assumptions explicit, which can guide further investigation and validation.
Which of the following is an alternative method of knowledge gap identification in the intrusion analysis process?	Using the resources meta-feature.	Using the tactics meta-feature.	Using the techniques meta-feature.	Using the nodes meta-feature.	A	The resources meta-feature provides insight into what might be missing in an analysis, guiding the analyst toward identifying knowledge gaps.
In the scenario, Event 9 can be tested in several ways. First, it is:	Simple and logical as all of its required resources are met necessitating no further events to be hypothesized.	Complex and illogical as many of its required resources are not met necessitating the hypothesizing of further events.	Simple and illogical as many of its required resources are met necessitating the hypothesizing of further events.	Complex and logical as many of its required resources are not met necessitating the hypothesizing of further events.	D	The complexity of Event 9 suggests it might not be straightforward to test, requiring the exploration of further potential events and resources.
The first step of analysis in the intrusion analysis process is to:	Define the question to be addressed.	Define the scope of the intrusion.	Define the adversary's preferred tactics and techniques.	Define the adversary's preferred infrastructure.	A	Establishing a clear question sets the focus and direction for the analysis, enabling systematic investigation.
What is the primary goal of analyzing an adversary’s infrastructure in the context of cyber threat analysis?	To identify potential attack vectors used by the adversary	To determine the financial impact of the attack on the victim	To understand the specific tools and methods used by the adversary	To establish the geographic location of the adversary	D	The primary goal of analyzing an adversary’s infrastructure is to understand the specific tools and methods used by the adversary, which helps in identifying their capabilities and tactics.
